<?xml version="1.0" encoding="UTF-8"?>
<!-- jscpd:ignore-start -->
<!DOCTYPE tvshow SYSTEM "tv.dtd">
<tvshow year="1999" rating="PG" season="1">
    <title>Futurama</title>
    <genrelist>
        <genre name="Animation"/>
        <genre name="SciFi"/>
        <genre name="Comedy"/>
    </genrelist>
    <creator>
        <firstname>Matt</firstname>
        <surname>Groening</surname>
    </creator>
    <cast>
        <castmember role="Philip J. Fry">
            <firstname>Billy</firstname>
            <surname>West</surname>
        </castmember>
        <castmember role="Turanga Leela">
            <firstname>Katey</firstname>
            <surname>Sagal</surname>
        </castmember>
    </cast>
</tvshow>
<!-- jscpd:ignore-end -->
